{
  "$schema": "https://json-schema.org/draft/2020-12/schema",
  "description": "The data type vocabulary: a SKOS concept scheme whose concepts are what Generic and Implementation Profile inputs/outputs point at with `dataType`. A type's `broader` type is what an Implementation Profile may narrow from (e.g. `raster` to `raster-single-band`).",
  "type": "object",
  "required": [
    "id",
    "type",
    "prefLabel",
    "concepts"
  ],
  "properties": {
    "id": {
      "const": "https://geolabs.github.io/bblocks-generic-profiles/def/data-type",
      "x-jsonld-id": "@id"
    },
    "type": {
      "const": "ConceptScheme",
      "x-jsonld-id": "@type"
    },
    "prefLabel": {
      "type": "string",
      "x-jsonld-id": "http://www.w3.org/2004/02/skos/core#prefLabel"
    },
    "definition": {
      "type": "string",
      "x-jsonld-id": "http://www.w3.org/2004/02/skos/core#definition"
    },
    "concepts": {
      "type": "array",
      "minItems": 1,
      "items": {
        "type": "object",
        "required": [
          "id",
          "type",
          "prefLabel",
          "definition",
          "source"
        ],
        "properties": {
          "id": {
            "type": "string",
            "format": "uri",
            "pattern": "^https://geolabs\\.github\\.io/bblocks\\-generic\\-profiles/def/data\\-type/",
            "x-jsonld-id": "@id"
          },
          "type": {
            "const": "DataType",
            "x-jsonld-id": "@type"
          },
          "prefLabel": {
            "type": "string",
            "x-jsonld-id": "http://www.w3.org/2004/02/skos/core#prefLabel"
          },
          "definition": {
            "type": "string",
            "x-jsonld-id": "http://www.w3.org/2004/02/skos/core#definition"
          },
          "broader": {
            "type": "array",
            "items": {
              "type": "string",
              "format": "uri"
            },
            "x-jsonld-id": "http://www.w3.org/2004/02/skos/core#broader",
            "x-jsonld-type": "@id"
          },
          "source": {
            "type": "array",
            "minItems": 1,
            "items": {
              "type": "object",
              "required": [
                "title"
              ],
              "properties": {
                "title": {
                  "type": "string",
                  "x-jsonld-id": "http://purl.org/dc/terms/title"
                },
                "link": {
                  "type": "string",
                  "format": "uri",
                  "x-jsonld-id": "http://purl.org/dc/terms/references",
                  "x-jsonld-type": "@id"
                }
              }
            },
            "x-jsonld-id": "http://purl.org/dc/terms/source"
          }
        }
      },
      "x-jsonld-reverse": "skos:inScheme"
    }
  },
  "x-jsonld-extra-terms": {
    "ConceptScheme": "http://www.w3.org/2004/02/skos/core#ConceptScheme",
    "DataType": "http://www.w3.org/2004/02/skos/core#Concept",
    "clause": "https://geolabs.github.io/bblocks-generic-profiles/def/clause"
  },
  "x-jsonld-prefixes": {
    "skos": "http://www.w3.org/2004/02/skos/core#",
    "dct": "http://purl.org/dc/terms/",
    "gp": "https://geolabs.github.io/bblocks-generic-profiles/def/"
  }
}